artist,caption,date,day_number,description,image_filepath,image_url,location,medium,mystery_name,mystery_type,original_title,original_title_ISO_code,original_title_language,style,subject,title
Henry Ossawa Tanner,Christ and the Disciples Before the Last Supper by Henry Ossawa Tanner,ca. 1900,178,"A solemn depiction of Christ and His disciples in prayer before the Last Supper, highlighting Tanner's mastery of light and spirituality.",June/jpgs/christdiscipleshenrytanner.jpg,https://upload.wikimedia.org/wikipedia/commons/a/ae/Christ_and_the_Disciples_Before_the_Last_Supper_by_Henry_Ossawa_Tanner.jpg,"Philadelphia Museum of Art, Philadelphia, USA",Oil on canvas,The Institution of the Eucharist,Luminous,,,,Realism,Christ and disciples preparing for the Last Supper,Christ and the Disciples Before the Last Supper
Giotto di Bondone,The Arrest of Christ Kiss of Judas by Giotto,1304-1306,179,"Giotto's fresco captures the dramatic moment of Judas betraying Christ with a kiss, emphasizing emotional intensity and human realism.",June/jpgs/arrestofchristgiotto.jpg,https://upload.wikimedia.org/wikipedia/commons/e/ef/Giotto_-_Scrovegni_-_-31-_-_Kiss_of_Judas.jpg,"Scrovegni Chapel, Padua, Italy",Fresco,The Agony in the Garden,Sorrowful,Il Bacio di Giuda,ita,Italian,Early Renaissance,Judas betraying Christ with a kiss,The Arrest of Christ (Kiss of Judas)
William-Adolphe Bouguereau,The Flagellation of Our Lord Jesus Christ by Bouguereau,1880,180,"Bouguereau's painting portrays Christ's suffering during the flagellation, showcasing his technical precision and emotional depth.",June/jpgs/flagellationbouguereau.jpg,https://upload.wikimedia.org/wikipedia/commons/5/56/William-Adolphe_Bouguereau_%281825-1905%29_-_The_Flagellation_of_Our_Lord_Jesus_Christ_%281880%29.jpg,"Cathedral of La Rochelle, France",Oil on canvas,The Scourging at the Pillar,Sorrowful,La Flagellation du Christ,fra,French,Academicism,Christ being scourged at the pillar,The Flagellation of Our Lord Jesus Christ
Anthony van Dyck,"Van Dyck's _The Crowning with Thorns_ (early 17th century), a Baroque depiction of Christ's suffering and paradoxical triumph",Early 17th century,181,"Van Dyck's Baroque work captures Christ's anguish and dignity during the crowning with thorns, emphasizing divine triumph through suffering.",June/jpgs/crowningthornsvandyck17th.jpg,https://upload.wikimedia.org/wikipedia/commons/thumb/2/23/Anthonis_van_Dyck_004.jpg/960px-Anthonis_van_Dyck_004.jpg,"Museo del Prado, Madrid, Spain",Oil on canvas,The Crowning with Thorns,Sorrowful,De Doornenkroning,nld,Dutch,Baroque,Christ being crowned with thorns,The Crowning with Thorns
Raphael (Raffaello Sanzio),"Raphael's Christ Falls on the Way to Calvary, a painting depicting Christ stumbling under the cross with Mary and a crowd witnessing",ca. 1516-1517,182,"Raphael's depiction of Christ's fall under the cross combines dramatic movement with serene beauty, reflecting High Renaissance ideals.",July/jpgs/christfallswaycalvaryraphael.jpg,https://upload.wikimedia.org/wikipedia/commons/4/44/Raffaello_Sanzio_-_Christ_Falls_on_the_Way_to_Calvary_-_WGA18828.jpg,"Museo del Prado, Madrid, Spain",Oil on panel,The Carrying of the Cross,Sorrowful,Christo che cade sotto la croce,ita,Italian,High Renaissance,Christ stumbling under the cross,Christ Falls on the Way to Calvary
Peter Paul Rubens,"The Descent from the Cross (1616-1617) by Rubens: A dynamic, dramatic depiction of Christ's descent",1616-1617,183,"Rubens' Baroque masterpiece vividly portrays the descent of Christ's body from the cross, filled with emotion and movement.",July/jpgs/descentrubens1617.jpg,https://upload.wikimedia.org/wikipedia/commons/0/0f/Peter_Paul_Rubens_-_Descent_from_the_cross_%281617%29.jpg,"Cathedral of Our Lady, Antwerp, Belgium",Oil on panel,The Crucifixion,Sorrowful,De Kruisafneming,nld,Dutch,Baroque,Christ being taken down from the cross,The Descent from the Cross
Annibale Carracci,"The Three Marys at the Tomb by Annibale Carracci, 17th century at Hermitage Museum, reveals Baroque vividness and drama",17th century,184,"Carracci's Baroque work depicts the moment the three Marys find Christ's tomb empty, emphasizing divine light and resurrection hope.",July/jpgs/holywomencarracci.jpg,https://upload.wikimedia.org/wikipedia/commons/8/83/Annibale_Carracci_-_Holy_Women_at_Christ%27_s_Tomb_-_WGA4454.jpg,"Hermitage Museum, Saint Petersburg, Russia",Oil on canvas,The Resurrection,Glorious,Le Tre Marie al Sepolcro,ita,Italian,Baroque,The three Marys discovering the empty tomb of Christ,The Three Marys at the Tomb
Duccio di Buoninsegna,"Christ Taking Leave of the Apostles by Duccio, 14th century, Museo dell'Opera, tempera on wood, Gothic details",1308-1311,185,"Duccio's Gothic panel shows Christ's ascension, combining gold leaf detailing with spiritual solemnity and Byzantine influences.",July/jpgs/appearancemountainduccio.jpg,https://upload.wikimedia.org/wikipedia/commons/e/e1/Duccio_di_Buoninsegna_-_Appearance_on_the_Mountain_in_Galilee_-_WGA06737.jpg,"Museo dell'Opera del Duomo, Siena, Italy",Tempera on wood,The Ascension,Glorious,Cristo che lascia gli apostoli,ita,Italian,Gothic,Christ bidding farewell to His apostles,Christ Taking Leave of the Apostles
Simone Peterzano,Simone Peterzano's Pentecost depicts the Virgin and disciples receiving the Holy Spirit in Mannerist style,Late 16th century,186,"Peterzano's Mannerist work captures the fiery descent of the Holy Spirit, blending dramatic gestures with divine illumination.",July/jpgs/pentecostsimonepeterzano.jpg,https://images-cdn.bridgemanimages.com/api/1.0/image/600wm.XXX.12926920.7055475/2959742.jpg,"Church of San Fedele, Milan, Italy",Oil on canvas,The Descent of the Holy Spirit,Glorious,La Pentecoste,ita,Italian,Mannerism,The descent of the Holy Spirit upon Mary and the apostles,Pentecost
,The Divine Exchange Between Mother and Son,,187,"This Gothic stained-glass window illustrates Mary's assumption into heaven, radiant with light and celestial glory.",July/jpgs/cathedralburgos.jpg,https://c8.alamy.com/comp/PR002K/stained-glass-window-depicting-the-assumption-of-mary-in-the-cathedral-of-burgos-castille-spain-PR002K.jpg,"Cathedral of Burgos, Spain",Stained glass,The Assumption of Mary,Glorious,La Asunción de María,spa,Spanish,Gothic,The Virgin Mary's assumption into heaven,The Assumption of Mary
Giuseppe Rollini,"Mary, Help of Christians by Giuseppe Rollini",,188,"A fresco depicting the Virgin Mary as the Helper of Christians, showcasing her maternal care and intercessory role in the faith.",July/jpgs/maryhelpofchristiansrolini.jpg,https://c8.alamy.com/comp/JBNNMG/turin-italy-march-15-2017-the-detail-of-fresco-mary-help-of-christians-JBNNMG.jpg,"Turin, Italy",Fresco,The Assumption of Mary,Glorious,Maria Ausiliatrice dei Cristiani,it,Italian,Religious Art,Virgin Mary,"Mary, Help of Christians"
